[
  {
    "id": "FS44936",
    "make": "Hyundai",
    "model": "IONIQ Electric Drive",
    "year": 2022,
    "slug": "hyundai-ioniq-electric-drive-2022-fs44936",
    "price": 25000,
    "image": "/images/cars/hyundai_ioniq_electric/hyundai_ioniq.jpg",
    "description": "Hyundai IONIQ Electric (136 Hp), Aut. LED, Widescreen, Navi, Apple CarPlay. VIN: KMHC85AC1NU123456. Origem Portugal.",
    "mileage": 50000,
    "country": "PT",
    "status": "",
    "gearboxType": "Automático",
    "gearbox": 1,
    "category": "Berlina",
    "engineSize": "Elétrico",
    "power": "136 Hp 100 kW",
    "places": 5,
    "unitNumber": "FS44936",
    "origin": "Portugal",
    "firstRegistration": "01/01/2022",
    "doors": 5,
    "fuel": "Elétrico",
    "emissionClass": "Zero",
    "co2": "0 g/km",
    "color": "Branco",
    "images": [
      "/images/cars/hyundai_ioniq_electric/hyundai_ioniq.jpg",
      "/images/cars/hyundai_ioniq_electric/hyundai_ioniq1.jpg",
      "/images/cars/hyundai_ioniq_electric/hyundai_ioniq2.jpg",
      "/images/cars/hyundai_ioniq_electric/hyundai_ioniq3.jpg",
      "/images/cars/hyundai_ioniq_electric/hyundai_ioniq4.jpg",
      "/images/cars/hyundai_ioniq_electric/hyundai_ioniq5.jpg",
      "/images/cars/hyundai_ioniq_electric/hyundai_ioniq6.jpg",
      "/images/cars/hyundai_ioniq_electric/hyundai_ioniq7.jpg",
      "/images/cars/hyundai_ioniq_electric/hyundai_ioniq8.jpg",
      "/images/cars/hyundai_ioniq_electric/hyundai_ioniq9.jpg",
      "/images/cars/hyundai_ioniq_electric/hyundai_ioniq10.jpg",
      "/images/cars/hyundai_ioniq_electric/hyundai_ioniq11.jpg",
      "/images/cars/hyundai_ioniq_electric/hyundai_ioniq12.jpg",
      "/images/cars/hyundai_ioniq_electric/hyundai_ioniq13.jpg",
      "/images/cars/hyundai_ioniq_electric/hyundai_ioniq14.jpg",
      "/images/cars/hyundai_ioniq_electric/hyundai_ioniq15.jpg",
      "/images/cars/hyundai_ioniq_electric/hyundai_ioniq16.jpg",
      "/images/cars/hyundai_ioniq_electric/hyundai_ioniq17.jpg"
    ],
    "equipamento_opcoes": {
      "opcoes_valor_elevado": [
        "Faróis LED",
        "Sistema de navegação",
        "Apple CarPlay",
        "Android Auto"
      ],
      "opcoes_valor_medio": [
        "Ar condicionado automático",
        "Sensores de estacionamento",
        "Câmera de marcha-atrás"
      ],
      "opcoes_valor_baixo": [
        "Rádio digital",
        "Bluetooth",
        "Controlo de cruzeiro"
      ]
    }
  },
  {
    "id": "6702209",
    "make": "Mercedes-Benz",
    "model": "A-klasse",
    "year": 2021,
    "slug": "mercedes-benz-a-klasse-2021-6702209",
    "price": 22990,
    "image": "/images/cars/mercedes_a_klasse/mercedes_a_klasse.jpg",
    "description": "Mercedes-Benz A 200 AMG Line (163 Hp), Aut. LED, Widescreen, Navi, Apple CarPlay. VIN: W1K1770131G087441. Origem Luxemburgo (Windhof).",
    "mileage": 134935,
    "country": "LU",
    "status": "",
    "gearboxType": "Automático",
    "gearbox": 7,
    "category": "Berlina",
    "engineSize": "1332 cc",
    "power": "163 Hp 120 kW",
    "places": 5,
    "unitNumber": "6702209",
    "origin": "Luxemburgo",
    "firstRegistration": "23/08/2021",
    "doors": 5,
    "fuel": "Híbrido (Gasolina/Elétrico)",
    "emissionClass": "Euro6",
    "co2": "34 g/km",
    "color": "Prata",
    "images": [
      "/images/cars/mercedes_a_klasse/mercedes_a_klasse.jpg",
      "/images/cars/mercedes_a_klasse/mercedes_a_klasse1.jpg",
      "/images/cars/mercedes_a_klasse/mercedes_a_klasse2.jpg",
      "/images/cars/mercedes_a_klasse/mercedes_a_klasse3.jpg",
      "/images/cars/mercedes_a_klasse/mercedes_a_klasse4.jpg",
      "/images/cars/mercedes_a_klasse/mercedes_a_klasse5.jpg",
      "/images/cars/mercedes_a_klasse/mercedes_a_klasse6.jpg",
      "/images/cars/mercedes_a_klasse/mercedes_a_klasse7.jpg",
      "/images/cars/mercedes_a_klasse/mercedes_a_klasse8.jpg",
      "/images/cars/mercedes_a_klasse/mercedes_a_klasse9.jpg",
      "/images/cars/mercedes_a_klasse/mercedes_a_klasse10.jpg",
      "/images/cars/mercedes_a_klasse/mercedes_a_klasse11.jpg",
      "/images/cars/mercedes_a_klasse/mercedes_a_klasse12.jpg",
      "/images/cars/mercedes_a_klasse/mercedes_a_klasse13.jpg",
      "/images/cars/mercedes_a_klasse/mercedes_a_klasse14.jpg",
      "/images/cars/mercedes_a_klasse/mercedes_a_klasse15.jpg",
      "/images/cars/mercedes_a_klasse/mercedes_a_klasse16.jpg",
      "/images/cars/mercedes_a_klasse/mercedes_a_klasse17.jpg"
    ],
    "equipamento_opcoes": {
      "opcoes_valor_elevado": [
        "Faróis LED",
        "Sistema de navegação",
        "Apple CarPlay",
        "Android Auto"
      ],
      "opcoes_valor_medio": [
        "Ar condicionado automático",
        "Sensores de estacionamento",
        "Câmera de marcha-atrás"
      ],
      "opcoes_valor_baixo": [
        "Rádio digital",
        "Bluetooth",
        "Controlo de cruzeiro"
      ]
    }
  }
]
