{
  "id": "6442738",
  "make": "Volvo",
  "model": "XC40",
  "year": 2023,
  "slug": "volvo-xc40-2023-6442738",
  "price": 17200,
  "image": "/images/cars/volvo_xc40_hybrid/volvo_xc40_hybrid.jpg",
  "description": "Volvo XC40 1.5 T4 Plug-In Hybrid Aut. LED-Xenon Virtual Harman/Kardon Navi Sport-Seats KeylessGo Camera Klima PDC ...",
  "mileage": 171029,
  "country": "BE",
  "status": "",
  "gearboxType": "Automático",
  "gearbox": 7,
  "category": "SUV",
  "engineSize": "1477 cc",
  "power": "129 Hp 95 kW",
  "places": 5,
  "unitNumber": "6442738",
  "origin": "Bélgica",
  "firstRegistration": "25/05/2023",
  "doors": 5,
  "fuel": "Híbrido (Gasolina/Elétrico)",
  "emissionClass": "Euro6",
  "co2": "47 g/km",
  "color": "Azul",
  "images": [
    "/images/cars/volvo_xc40_hybrid/volvo_xc40_hybrid.jpg",
    "/images/cars/volvo_xc40_hybrid/volvo_xc40_hybrid1.jpg",
    "/images/cars/volvo_xc40_hybrid/volvo_xc40_hybrid2.jpg",
    "/images/cars/volvo_xc40_hybrid/volvo_xc40_hybrid3.jpg",
    "/images/cars/volvo_xc40_hybrid/volvo_xc40_hybrid4.jpg",
    "/images/cars/volvo_xc40_hybrid/volvo_xc40_hybrid5.jpg",
    "/images/cars/volvo_xc40_hybrid/volvo_xc40_hybrid6.jpg",
    "/images/cars/volvo_xc40_hybrid/volvo_xc40_hybrid7.jpg",
    "/images/cars/volvo_xc40_hybrid/volvo_xc40_hybrid8.jpg",
    "/images/cars/volvo_xc40_hybrid/volvo_xc40_hybrid9.jpg",
    "/images/cars/volvo_xc40_hybrid/volvo_xc40_hybrid10.jpg",
    "/images/cars/volvo_xc40_hybrid/volvo_xc40_hybrid11.jpg",
    "/images/cars/volvo_xc40_hybrid/volvo_xc40_hybrid12.jpg",
    "/images/cars/volvo_xc40_hybrid/volvo_xc40_hybrid13.jpg",
    "/images/cars/volvo_xc40_hybrid/volvo_xc40_hybrid14.jpg",
    "/images/cars/volvo_xc40_hybrid/volvo_xc40_hybrid15.jpg",
    "/images/cars/volvo_xc40_hybrid/volvo_xc40_hybrid16.jpg",
    "/images/cars/volvo_xc40_hybrid/volvo_xc40_hybrid17.jpg",
    "/images/cars/volvo_xc40_hybrid/volvo_xc40_hybrid18.jpg",
    "/images/cars/volvo_xc40_hybrid/volvo_xc40_hybrid19.jpg",
    "/images/cars/volvo_xc40_hybrid/volvo_xc40_hybrid20.jpg",
    "/images/cars/volvo_xc40_hybrid/volvo_xc40_hybrid21.jpg",
    "/images/cars/volvo_xc40_hybrid/volvo_xc40_hybrid22.jpg",
    "/images/cars/volvo_xc40_hybrid/volvo_xc40_hybrid23.jpg",
    "/images/cars/volvo_xc40_hybrid/volvo_xc40_hybrid24.jpg",
    "/images/cars/volvo_xc40_hybrid/volvo_xc40_hybrid25.jpg",
    "/images/cars/volvo_xc40_hybrid/volvo_xc40_hybrid26.jpg"
  ],
  "equipamento_opcoes": {
    "opcoes_valor_elevado": [
      "Sistema de áudio de alta performance",
      "Sistema de navegação",
      "Interior desportivo",
      "Bancos desportivos"
    ],
    "conforto": [
      "Faróis adaptativos",
      "Ar condicionado: Automático (2 zonas)",
      "Cruise control",
      "Bancos aquecidos",
      "Ajuste elétrico dos bancos",
      "Retrovisores elétricos",
      "Vidros elétricos",
      "Keyless go",
      "Sensor de luz",
      "Volante multifunções",
      "Sensor de chuva",
      "Teto de abrir",
      "Memória dos bancos",
      "Sistema start-stop"
    ],
    "seguranca": [
      "ABS",
      "Luzes diurnas",
      "ESP",
      "Faróis de nevoeiro",
      "Airbags: Frontais, laterais e mais",
      "Imobilizador",
      "Isofix"
    ],
    "multimedia": [
      "Bluetooth",
      "Leitor de CD",
      "Sistema de áudio de alta performance",
      "Interface MP3",
      "Sistema de navegação",
      "Computador de bordo",
      "Rádio"
    ],
    "interior": [
      "Interior desportivo",
      "Bancos desportivos"
    ],
    "exterior": [
      "Jantes de liga leve",
      "Cor metálica",
      "Pacote desportivo",
      "Gancho de reboque"
    ],
    "outros": [
      "Elektr. bed. achterklep",
      "Trekhaak afneembaar",
      "Connectiviteit af fabriek",
      "Audio optie_anders (af fabriek)",
      "Elektrisch verst. stoelen",
      "Achteruitrijcamera",
      "Hoofdsleutel",
      "Reservesleutel",
      "Bandenreparatieset",
      "Publieke laadpaalkabel",
      "Instructieboekje",
      "Onderhoudsboekje (boekje)",
      "Hoedenplank/rolhoes",
      "Faróis LED",
      "Ski bag",
      "Controlo de tração"
    ]
  }
}
